{
  "paper_id": "test_gold_nanorod",
  "paper_domain": "plasmonics",
  "title": "Gold Nanorod Optical Properties Reproduction",
  "summary": "Reproduce extinction spectrum and near-field enhancement of gold nanorod in water",
  "main_system": "Gold nanorod in aqueous environment",
  "main_claims": ["Longitudinal plasmon resonance at ~700nm", "Extinction cross-section enhancement"],
  "simulation_approach": "FDTD with Meep",
  "stages": [
    {
      "stage_id": "stage_0_materials",
      "stage_type": "MATERIAL_VALIDATION",
      "name": "Gold Material Validation",
      "description": "Validate gold optical properties from Johnson & Christy database",
      "targets": ["material_gold"],
      "dependencies": [],
      "runtime_budget_minutes": 5,
      "expected_outputs": [
        {
          "artifact_type": "spectrum_csv",
          "filename_pattern": "{paper_id}_{stage_id}_permittivity.csv",
          "description": "Gold permittivity vs wavelength",
          "columns": ["wavelength_nm", "epsilon_real", "epsilon_imag"]
        }
      ]
    },
    {
      "stage_id": "stage_1_extinction",
      "stage_type": "SINGLE_STRUCTURE",
      "name": "Extinction Spectrum",
      "description": "Simulate gold nanorod extinction spectrum",
      "targets": ["Fig1"],
      "dependencies": ["stage_0_materials"],
      "runtime_budget_minutes": 30,
      "expected_outputs": [
        {
          "artifact_type": "spectrum_csv",
          "filename_pattern": "{paper_id}_{stage_id}_extinction.csv",
          "description": "Extinction cross-section vs wavelength",
          "columns": ["wavelength_nm", "extinction"],
          "target_figure": "Fig1"
        }
      ]
    }
  ],
  "targets": [
    {
      "figure_id": "Fig1",
      "description": "Extinction spectrum of gold nanorod",
      "type": "spectrum",
      "simulation_class": "FDTD_DIRECT",
      "precision_requirement": "acceptable"
    }
  ],
  "extracted_parameters": [
    {
      "name": "nanorod_length",
      "value": 100,
      "unit": "nm",
      "source": "text",
      "location": "Section 2, paragraph 1"
    },
    {
      "name": "nanorod_diameter",
      "value": 40,
      "unit": "nm",
      "source": "text",
      "location": "Section 2, paragraph 1"
    },
    {
      "name": "medium_refractive_index",
      "value": 1.33,
      "unit": "",
      "source": "text",
      "location": "Section 2, Methods"
    }
  ],
  "planned_materials": [
    {
      "material_id": "gold_jc",
      "name": "Gold (Johnson-Christy)",
      "suggested_source": "johnson_christy",
      "path": "materials/johnson_christy/Au.csv"
    }
  ],
  "assumptions": {
    "global_assumptions": [
      {
        "id": "A1",
        "category": "material",
        "description": "Gold properties from Johnson & Christy 1972 database",
        "reason": "Standard reference for gold optical constants",
        "source": "literature_default",
        "critical": true,
        "validated": false,
        "validation_stage": "stage_0_materials"
      }
    ]
  },
  "reproduction_scope": {
    "total_figures": 3,
    "reproducible_figures": 1,
    "attempted_figures": ["Fig1"],
    "skipped_figures": [
      {
        "figure_id": "Fig2",
        "reason": "TEM image - not simulation reproducible",
        "classification": "not_reproducible"
      }
    ]
  },
  "progress": {
    "stages": [
      {"stage_id": "stage_0_materials", "status": "not_started", "summary": ""},
      {"stage_id": "stage_1_extinction", "status": "not_started", "summary": ""}
    ]
  },
  "staging_rationale": "Material validation first to ensure accurate gold optical constants, then single nanorod simulation for extinction spectrum."
}
